{
  "$schema": "https://json-schema.org/draft/2020-12/schema",
  "$id": "https://raw.githubusercontent.com/vanderbr/rates/main/schemas/v1/actuarial-table-b.schema.json",
  "title": "actuarial-table-b",
  "type": "array",
  "items": {
    "type": "object",
    "additionalProperties": false,
    "required": [
      "term_years",
      "annuity_factor_scaled_1e6",
      "income_interest_factor_scaled_1e6",
      "remainder_factor_scaled_1e6"
    ],
    "properties": {
      "term_years": {
        "type": "integer",
        "minimum": 0
      },
      "annuity_factor_scaled_1e6": {
        "type": "integer",
        "minimum": 0
      },
      "income_interest_factor_scaled_1e6": {
        "type": "integer",
        "minimum": 0
      },
      "remainder_factor_scaled_1e6": {
        "type": "integer",
        "minimum": 0
      }
    }
  }
}
