[
  {
    "term_years": 1,
    "annuity_factor_scaled_1e6": 990100,
    "income_interest_factor_scaled_1e6": 9901,
    "remainder_factor_scaled_1e6": 990099
  },
  {
    "term_years": 2,
    "annuity_factor_scaled_1e6": 1970400,
    "income_interest_factor_scaled_1e6": 19704,
    "remainder_factor_scaled_1e6": 980296
  },
  {
    "term_years": 3,
    "annuity_factor_scaled_1e6": 2941000,
    "income_interest_factor_scaled_1e6": 29410,
    "remainder_factor_scaled_1e6": 970590
  },
  {
    "term_years": 4,
    "annuity_factor_scaled_1e6": 3902000,
    "income_interest_factor_scaled_1e6": 39020,
    "remainder_factor_scaled_1e6": 960980
  },
  {
    "term_years": 5,
    "annuity_factor_scaled_1e6": 4853400,
    "income_interest_factor_scaled_1e6": 48534,
    "remainder_factor_scaled_1e6": 951466
  },
  {
    "term_years": 6,
    "annuity_factor_scaled_1e6": 5795500,
    "income_interest_factor_scaled_1e6": 57955,
    "remainder_factor_scaled_1e6": 942045
  },
  {
    "term_years": 7,
    "annuity_factor_scaled_1e6": 6728200,
    "income_interest_factor_scaled_1e6": 67282,
    "remainder_factor_scaled_1e6": 932718
  },
  {
    "term_years": 8,
    "annuity_factor_scaled_1e6": 7651700,
    "income_interest_factor_scaled_1e6": 76517,
    "remainder_factor_scaled_1e6": 923483
  },
  {
    "term_years": 9,
    "annuity_factor_scaled_1e6": 8566000,
    "income_interest_factor_scaled_1e6": 85660,
    "remainder_factor_scaled_1e6": 914340
  },
  {
    "term_years": 10,
    "annuity_factor_scaled_1e6": 9471300,
    "income_interest_factor_scaled_1e6": 94713,
    "remainder_factor_scaled_1e6": 905287
  },
  {
    "term_years": 11,
    "annuity_factor_scaled_1e6": 10367600,
    "income_interest_factor_scaled_1e6": 103676,
    "remainder_factor_scaled_1e6": 896324
  },
  {
    "term_years": 12,
    "annuity_factor_scaled_1e6": 11255100,
    "income_interest_factor_scaled_1e6": 112551,
    "remainder_factor_scaled_1e6": 887449
  },
  {
    "term_years": 13,
    "annuity_factor_scaled_1e6": 12133700,
    "income_interest_factor_scaled_1e6": 121337,
    "remainder_factor_scaled_1e6": 878663
  },
  {
    "term_years": 14,
    "annuity_factor_scaled_1e6": 13003700,
    "income_interest_factor_scaled_1e6": 130037,
    "remainder_factor_scaled_1e6": 869963
  },
  {
    "term_years": 15,
    "annuity_factor_scaled_1e6": 13865100,
    "income_interest_factor_scaled_1e6": 138651,
    "remainder_factor_scaled_1e6": 861349
  },
  {
    "term_years": 16,
    "annuity_factor_scaled_1e6": 14717900,
    "income_interest_factor_scaled_1e6": 147179,
    "remainder_factor_scaled_1e6": 852821
  },
  {
    "term_years": 17,
    "annuity_factor_scaled_1e6": 15562300,
    "income_interest_factor_scaled_1e6": 155623,
    "remainder_factor_scaled_1e6": 844377
  },
  {
    "term_years": 18,
    "annuity_factor_scaled_1e6": 16398300,
    "income_interest_factor_scaled_1e6": 163983,
    "remainder_factor_scaled_1e6": 836017
  },
  {
    "term_years": 19,
    "annuity_factor_scaled_1e6": 17226000,
    "income_interest_factor_scaled_1e6": 172260,
    "remainder_factor_scaled_1e6": 827740
  },
  {
    "term_years": 20,
    "annuity_factor_scaled_1e6": 18045600,
    "income_interest_factor_scaled_1e6": 180456,
    "remainder_factor_scaled_1e6": 819544
  },
  {
    "term_years": 21,
    "annuity_factor_scaled_1e6": 18857000,
    "income_interest_factor_scaled_1e6": 188570,
    "remainder_factor_scaled_1e6": 811430
  },
  {
    "term_years": 22,
    "annuity_factor_scaled_1e6": 19660400,
    "income_interest_factor_scaled_1e6": 196604,
    "remainder_factor_scaled_1e6": 803396
  },
  {
    "term_years": 23,
    "annuity_factor_scaled_1e6": 20455800,
    "income_interest_factor_scaled_1e6": 204558,
    "remainder_factor_scaled_1e6": 795442
  },
  {
    "term_years": 24,
    "annuity_factor_scaled_1e6": 21243400,
    "income_interest_factor_scaled_1e6": 212434,
    "remainder_factor_scaled_1e6": 787566
  },
  {
    "term_years": 25,
    "annuity_factor_scaled_1e6": 22023200,
    "income_interest_factor_scaled_1e6": 220232,
    "remainder_factor_scaled_1e6": 779768
  },
  {
    "term_years": 26,
    "annuity_factor_scaled_1e6": 22795200,
    "income_interest_factor_scaled_1e6": 227952,
    "remainder_factor_scaled_1e6": 772048
  },
  {
    "term_years": 27,
    "annuity_factor_scaled_1e6": 23559600,
    "income_interest_factor_scaled_1e6": 235596,
    "remainder_factor_scaled_1e6": 764404
  },
  {
    "term_years": 28,
    "annuity_factor_scaled_1e6": 24316400,
    "income_interest_factor_scaled_1e6": 243164,
    "remainder_factor_scaled_1e6": 756836
  },
  {
    "term_years": 29,
    "annuity_factor_scaled_1e6": 25065800,
    "income_interest_factor_scaled_1e6": 250658,
    "remainder_factor_scaled_1e6": 749342
  },
  {
    "term_years": 30,
    "annuity_factor_scaled_1e6": 25807700,
    "income_interest_factor_scaled_1e6": 258077,
    "remainder_factor_scaled_1e6": 741923
  },
  {
    "term_years": 31,
    "annuity_factor_scaled_1e6": 26542300,
    "income_interest_factor_scaled_1e6": 265423,
    "remainder_factor_scaled_1e6": 734577
  },
  {
    "term_years": 32,
    "annuity_factor_scaled_1e6": 27269600,
    "income_interest_factor_scaled_1e6": 272696,
    "remainder_factor_scaled_1e6": 727304
  },
  {
    "term_years": 33,
    "annuity_factor_scaled_1e6": 27989700,
    "income_interest_factor_scaled_1e6": 279897,
    "remainder_factor_scaled_1e6": 720103
  },
  {
    "term_years": 34,
    "annuity_factor_scaled_1e6": 28702700,
    "income_interest_factor_scaled_1e6": 287027,
    "remainder_factor_scaled_1e6": 712973
  },
  {
    "term_years": 35,
    "annuity_factor_scaled_1e6": 29408600,
    "income_interest_factor_scaled_1e6": 294086,
    "remainder_factor_scaled_1e6": 705914
  },
  {
    "term_years": 36,
    "annuity_factor_scaled_1e6": 30107500,
    "income_interest_factor_scaled_1e6": 301075,
    "remainder_factor_scaled_1e6": 698925
  },
  {
    "term_years": 37,
    "annuity_factor_scaled_1e6": 30799500,
    "income_interest_factor_scaled_1e6": 307995,
    "remainder_factor_scaled_1e6": 692005
  },
  {
    "term_years": 38,
    "annuity_factor_scaled_1e6": 31484700,
    "income_interest_factor_scaled_1e6": 314847,
    "remainder_factor_scaled_1e6": 685153
  },
  {
    "term_years": 39,
    "annuity_factor_scaled_1e6": 32163000,
    "income_interest_factor_scaled_1e6": 321630,
    "remainder_factor_scaled_1e6": 678370
  },
  {
    "term_years": 40,
    "annuity_factor_scaled_1e6": 32834700,
    "income_interest_factor_scaled_1e6": 328347,
    "remainder_factor_scaled_1e6": 671653
  },
  {
    "term_years": 41,
    "annuity_factor_scaled_1e6": 33499700,
    "income_interest_factor_scaled_1e6": 334997,
    "remainder_factor_scaled_1e6": 665003
  },
  {
    "term_years": 42,
    "annuity_factor_scaled_1e6": 34158100,
    "income_interest_factor_scaled_1e6": 341581,
    "remainder_factor_scaled_1e6": 658419
  },
  {
    "term_years": 43,
    "annuity_factor_scaled_1e6": 34810000,
    "income_interest_factor_scaled_1e6": 348100,
    "remainder_factor_scaled_1e6": 651900
  },
  {
    "term_years": 44,
    "annuity_factor_scaled_1e6": 35455500,
    "income_interest_factor_scaled_1e6": 354555,
    "remainder_factor_scaled_1e6": 645445
  },
  {
    "term_years": 45,
    "annuity_factor_scaled_1e6": 36094500,
    "income_interest_factor_scaled_1e6": 360945,
    "remainder_factor_scaled_1e6": 639055
  },
  {
    "term_years": 46,
    "annuity_factor_scaled_1e6": 36727200,
    "income_interest_factor_scaled_1e6": 367272,
    "remainder_factor_scaled_1e6": 632728
  },
  {
    "term_years": 47,
    "annuity_factor_scaled_1e6": 37353700,
    "income_interest_factor_scaled_1e6": 373537,
    "remainder_factor_scaled_1e6": 626463
  },
  {
    "term_years": 48,
    "annuity_factor_scaled_1e6": 37974000,
    "income_interest_factor_scaled_1e6": 379740,
    "remainder_factor_scaled_1e6": 620260
  },
  {
    "term_years": 49,
    "annuity_factor_scaled_1e6": 38588100,
    "income_interest_factor_scaled_1e6": 385881,
    "remainder_factor_scaled_1e6": 614119
  },
  {
    "term_years": 50,
    "annuity_factor_scaled_1e6": 39196100,
    "income_interest_factor_scaled_1e6": 391961,
    "remainder_factor_scaled_1e6": 608039
  },
  {
    "term_years": 51,
    "annuity_factor_scaled_1e6": 39798100,
    "income_interest_factor_scaled_1e6": 397981,
    "remainder_factor_scaled_1e6": 602019
  },
  {
    "term_years": 52,
    "annuity_factor_scaled_1e6": 40394200,
    "income_interest_factor_scaled_1e6": 403942,
    "remainder_factor_scaled_1e6": 596058
  },
  {
    "term_years": 53,
    "annuity_factor_scaled_1e6": 40984400,
    "income_interest_factor_scaled_1e6": 409844,
    "remainder_factor_scaled_1e6": 590156
  },
  {
    "term_years": 54,
    "annuity_factor_scaled_1e6": 41568700,
    "income_interest_factor_scaled_1e6": 415687,
    "remainder_factor_scaled_1e6": 584313
  },
  {
    "term_years": 55,
    "annuity_factor_scaled_1e6": 42147200,
    "income_interest_factor_scaled_1e6": 421472,
    "remainder_factor_scaled_1e6": 578528
  },
  {
    "term_years": 56,
    "annuity_factor_scaled_1e6": 42720000,
    "income_interest_factor_scaled_1e6": 427200,
    "remainder_factor_scaled_1e6": 572800
  },
  {
    "term_years": 57,
    "annuity_factor_scaled_1e6": 43287100,
    "income_interest_factor_scaled_1e6": 432871,
    "remainder_factor_scaled_1e6": 567129
  },
  {
    "term_years": 58,
    "annuity_factor_scaled_1e6": 43848600,
    "income_interest_factor_scaled_1e6": 438486,
    "remainder_factor_scaled_1e6": 561514
  },
  {
    "term_years": 59,
    "annuity_factor_scaled_1e6": 44404600,
    "income_interest_factor_scaled_1e6": 444046,
    "remainder_factor_scaled_1e6": 555954
  },
  {
    "term_years": 60,
    "annuity_factor_scaled_1e6": 44955000,
    "income_interest_factor_scaled_1e6": 449550,
    "remainder_factor_scaled_1e6": 550450
  }
]
